,start_date,source_url,source_title,source_full_text
31,2020-04-17,http://news.ontario.ca/omafra/en/2020/04/canada-and-ontario-supporting-agri-food-sector-supply-chain-during-covid-19.html,Canada and Ontario Supporting Agri-food Sector Supply Chain During COVID-19,"
Canada and Ontario Supporting Agri-food Sector Supply Chain During COVID-19
$1 million in new funding to support efforts that match employers with job-seekers

April 17, 2020  4:00 P.M.

Ministry of Agriculture, Food and Rural Affairs


TORONTO — The governments of Canada and Ontario are investing up to $1 million in new funding to connect workers with in-demand jobs in the agri-food sector to keep the nation's supply chains strong and store shelves stocked during the COVID-19 pandemic.
Through the Canadian Agricultural Partnership (the Partnership), the federal and provincial governments will provide support that will help people connect with job opportunities in the sector quickly. This program would help primary agriculture, food processing companies and grocery retail to recruit and train workers who are important to keeping the essential food supply chain functioning. ""The women and men who work on farms, in processing plants and throughout the food production chain, are doing an essential service for us during this critical time and we are thankful for their dedication and hard work,"" said the Honourable Marie-Claude Bibeau, federal Minister of Agriculture and Agri-Food. ""There is a strong need for workers on Canadian farms and in food processing businesses right now and our Government is taking concrete actions to find solutions, including through this new initiative, to ensure that Canadians continue to have high-quality food on their grocery store shelves and kitchen tables."" ""This is a very labour-intensive sector so it is critical to attract more people to ensure our food supply chain continues to provide healthy and nutritious food to Ontario families during this COVID-19 outbreak,"" said the Honourable Ernie Hardeman, Ontario Minister of Agriculture, Food and Rural Affairs. ""Our government is doing everything possible to ensure we support our farmers and food processors to fill job vacancies, including the development of a new web portal connecting workers with employers."" Through the Partnership's Place to Grow: Agri-Food Innovation Initiative, the Ontario Ministry of Agriculture, Food and Rural Affairs (OMAFRA) will immediately accept applications and will expedite the approval process to help address sector labour concerns quickly. Since June 2018, both the federal and provincial governments have committed support to approximately 2,500 projects, through the Partnership, to help eligible Ontario farmers, processors, businesses and sector organizations innovate and grow.

Quick Facts

Funding will be cost-shared by the Province.
The intake is provided under the Place to Grow: Agri-Food Innovation Initiative – Addressing Labour Supply and Training Challenges project category.
The Partnership is a five-year, $3-billion commitment by Canada's federal, provincial and territorial governments that supports Canada's agri-food and agri-products sectors.
This targeted intake will begin accepting applications on April 17, 2020. Eligible applications will be received and assessed on a continuous basis, while funding is available.
More information about this targeted intake and the program guidelines can be found online at: http://omafra.gov.on.ca/english/cap/labour_supply_training.htm or by calling: 1-877-424-1300.
This programming follows Ontario’s recent establishment of an online portal to help link agri-food sector employers with people interested in being a part of government’s response to COVID-19.
OMAFRA delivers cost-share funding under the Place to Grow program.
The Ontario agri-food sector supports more than 837,000 jobs in Ontario and contributes more than $47.5 billion each year to the province’s economy.



Additional Resources


The Canadian Agricultural Partnership in Ontario


Agriculture and Agri-Food Canada


Ontario Ministry of Agriculture, Food and Rural Affairs


									Visit Ontario's website to learn more about how the province continues to protect Ontarians from COVID-19 or to take a self assessment.
							


"
32,2020-04-17,http://news.ontario.ca/edu/en/2020/04/ontario-establishes-key-partnerships-to-make-home-learning-more-accessible.html,Ontario Establishes Key Partnerships to Make Home Learning More Accessible,"
Ontario Establishes Key Partnerships to Make Home Learning More Accessible
iPad Devices with Free Rogers Wireless Data Will Support Learning at Home 

April 17, 2020  1:30 P.M.

Ministry of Education


TORONTO — The Ontario government has partnered with Rogers Communications and Apple to help meet the educational needs of students and families during the COVID-19 outbreak. iPad devices are being purchased and distributed by Ontario school boards, pre-equipped with free Rogers LTE wireless data. Apple is providing ongoing support in French and English to teachers, parents and students, with a collection of resources to support learning and working from home.
""This important partnership will enable students to learn while making technology accessible for those that truly need it,"" said Stephen Lecce, Minister of Education. ""Our government is committed to ensuring equitable access to education, so that every child - irrespective of ability, geography or socio-economic circumstance - can continue their learning while schools are closed."" This week, Ontario school boards began distributing iPad devices to students who don't have either the technology or the Internet they need to access the Learn at Home program.  To date, over 21,000 will be sent to the homes of families in need. The free Rogers wireless data will be available until the end of June.   Also, Apple is providing videos, apps and books to help teachers build engaging lessons for students at home, along with fun and creative activities that kids and families can do with the built-in features of the iPad device. Apple is also offering teachers free one-to-one virtual coaching by Apple Professional Learning Specialists. In addition to providing free wireless data, Rogers is also working with Ontario school boards to provide high-speed, low-cost Internet to subsidized tenants and members of housing partners across Ontario through its Connected for Success program, as well as the Government of Canada Connecting Families initiative.  The Province has accelerated the delivery of broadband Internet access, currently on track to be in every high school in Ontario by September 2020 and elementary school by September 2021.  ""With this collaboration and commitment to ongoing support for remote learning, our school boards, Apple and Rogers clearly demonstrate the Ontario spirit and the incredible ability to overcome any obstacle for our kids,"" said Minister Lecce. ""For some of the most vulnerable members of our society, accessing online learning tools at home is an added burden at a time when there is already a lot of stress,"" said Dean Prevost, President, Rogers for Business. ""Rogers is pleased to be working alongside the Ontario Government, Apple and school boards across the province to help close the digital divide for some of our most vulnerable young people and their families.""

Quick Facts

Ontario’s Ministry of Education has collaborated with educators, school boards, Apple and Rogers to support the Learn at Home program with an iPad and integrated wireless remote learning solution to help meet the educational needs of our province’s families.
Working with Apple and Rogers, Ontario school boards now have access to affordable solutions with the iPad device, which is the most secure device for education that’s also easy to use, and to manage and deploy — so that no student is left behind while schools are closed due to the ongoing COVID-19 situation.
iPad devices will be purchased and distributed by Ontario school boards, pre-equipped with Rogers LTE wireless data. Rogers is providing this plan at no cost for the balance of the school year (until June 30, 2020). Students and families do not need to contact Rogers to set the devices up.
School boards will determine requirements for student eligibility to receive an iPad.
In addition, Rogers is allowing eligible households to sign up for high-speed Internet with no overage fees for $9.99 monthly.



Additional Resources


Learn at Home


Support for Families



"
33,2020-04-17,http://news.ontario.ca/opo/en/2020/04/ontario-offers-emergency-child-care-to-more-frontline-staff.html,Ontario Offers Emergency Child Care to More Frontline Staff,"
Ontario Offers Emergency Child Care to More Frontline Staff
Expansion Will Assist Essential Workers During the COVID-19 Outbreak

April 17, 2020  1:00 P.M.

Office of the Premier


TORONTO ― The Ontario government is expanding the list of essential workers eligible to receive emergency child care. This will help additional frontline staff during the COVID-19 outbreak. An emergency order was issued which will offer support to those providing a variety of critical services including people who assist vulnerable communities, emergency response and law enforcement sector staff, more health and safety workers, and certain federal employees.
The announcement was made today by Premier Doug Ford and Stephen Lecce, Minister of Education. ""Our frontline workers have made so many sacrifices and put the needs of the community ahead of themselves,"" said Premier Ford. ""These heroes work day-in and day-out to ensure everyone else can stay home and stay safe and healthy. The least we can do is ensure the safety of their children during these unprecedented times."" On March 20, 2020, the government issued an emergency order directing certain child care centres to reopen with fewer children to allow for physical distancing. This decision was made to support health care and other frontline workers responding to the COVID-19 outbreak. The list of essential workers eligible to access emergency childcare has now been expanded. ""Our frontline workers are making a real difference in our lives and deserve our support,"" said Stephen Lecce, Minister of Education. ""We are providing emergency child care to more frontline workers because in these unprecedented times, we will do whatever it takes to keep families safe, cared for, and healthy."" ""Dedicated people are on the frontlines, serving our most vulnerable in developmental services agencies, in residential care homes,"" said Todd Smith, Minister of Children, Community and Social Services. ""We need to support them by making sure their families are taken care of when they go to work."" The additional frontline workers who can now access emergency childcare services include: Staff working in developmental services, victim services, violence against women services, anti-human trafficking services and child welfare services (children's aid societies) and in children's residential settings;Additional staff identified by the Ministry of the Solicitor General, including:First Nations constables;Office of the Fire Marshal and Emergency Management fire investigators;Select critical staff in community corrections, such as probation and parole officers;Contractors in institutional corrections services;Frontline staff at the Provincial Forensic Pathology Unit;Critical staff at the Centre of Forensic Sciences; andCritical staff operating the Provincial Emergency Operations Centre.Staff working in shelters (e.g., serving homeless populations);Power workers;Pharmaceutical and medical supplies and device manufacturing workers;Non-municipal water and waste-water employees; andFederally employed staff including Royal Canadian Mounted Police (RCMP), Canada Border Services Agency (CBSA) officers and Canada Post employees. ""By ensuring staff who support some of our most vulnerable, including survivors of domestic violence, victims of human trafficking, and children and youth in care, have access to emergency child care, we can continue to provide these important services throughout the COVID-19 outbreak,"" said Jill Dunlop, Associate Minister of Children and Women's Issues. The Ontario Ministry of Education is working with Consolidated Municipal Service Managers (CMSM) and District Social Services Administration Boards (DSSAB) in their role as service system managers for early years and child care, as well as First Nations, to implement emergency child care centres in communities across the province. Ontario will continue to monitor local needs to ensure frontline staff can continue to work and will communicate more details as the situation evolves. A list of emergency child care centres is available on Ontario.ca/coronavirus.

Quick Facts

The need for child care spaces could grow by an estimated 11,300 during the eligibility expansion.
Since emergency child care was introduced last month, there are 74 child care centres up and running and home child care is being provided by 33 Licensed Home Child Care Agencies in communities across the province. 41 additional centres have also been approved and will be coming online in the coming days.
On April 14, 2020, the government issued an emergency order to give violence against women and anti-human trafficking agencies who deliver emergency residential services greater flexibility to address staffing challenges arising from the COVID-19 outbreak.



Additional Resources


Child care for health care and frontline staff


Province Takes Steps to Ensure Frontline Staff Can Continue to Work


Support for Families


									Visit Ontario's website to learn more about how the province continues to protect Ontarians from COVID-19.
							


"
34,2020-04-17,http://news.ontario.ca/opo/en/2020/04/ontario-takes-further-action-to-protect-vulnerable-people-from-covid-19.html, Ontario Takes Further Action to Protect Vulnerable People from COVID-19,"
 Ontario Takes Further Action to Protect Vulnerable People from COVID-19
 Province makes it easier to reassign staff where they are needed most

April 17, 2020  7:00 A.M.

Office of the Premier


TORONTO — To help stop the spread of COVID-19 among the province's most vulnerable citizens and ensure frontline services can continue to be delivered in priority areas, the Ontario government has issued new temporary emergency orders under the Emergency Management and Civil Protection Act.
""Every day, incredible sacrifices are being made by frontline workers in every region of the province to care for our most vulnerable citizens,"" said Premier Doug Ford. ""In order to better protect our seniors, people with various abilities, and the homeless population, along with our heroic frontline workers, our government is adopting emergency measures to provide flexibility in a variety of staffing arrangements to help stop the spread of this terrible virus."" The Emergency Measures issued to further protect vulnerable people during the COVID-19 outbreak include: Restricting retirement home employees from working in more than one retirement home, long-term care home or health care setting, with compliance required by April 22, 2020;Providing Local Health Integration Networks with the ability to direct home care service provider organizations to safely reassign frontline staff to areas where they are most needed, including home and community care settings, long-term care homes, supportive housing, retirement homes and hospitals;Providing municipalities and District Social Service Administration Boards with the flexibility to offer reassignments to certain staff to where there is local need during the outbreak, including child care, by-law enforcement, and public health services. ""We have heard the concerns of our municipal partners and are taking action to ensure they have the support they need to help their communities during the outbreak to address local needs,"" said Steve Clark, Minister of Municipal Affairs and Housing. ""Today our government is taking further action to protect both the residents and staff of retirement homes. The health and safety of retirement home residents is of the utmost importance,"" said Raymond Cho, Minister for Seniors and Accessibility. ""We must stop the spread of COVID-19 and we must do everything we can to protect retirement home residents and staff."" In order to ensure there are enough paramedics and emergency medical attendants, ambulance services will have the flexibility to hire and assign college students who have not yet completed exams or graduated, to provide services appropriate to their competence level and scope of practice. ""We continue to take decisive action to contain the virus and support our heroic frontline workers during this challenging time,"" said Christine Elliott, Deputy Premier and Minister of Health. ""Expanding the capacity of our health care workforce will support their incredible efforts to provide patients with the care they need."" With the new staffing flexibility measures, municipalities or District Social Services Administration Boards will determine where there is a local need for staffing to deliver particular services. These employers have to comply with all provincial orders, as well as any guidance and safety standards prescribed by the Ontario government for COVID-19. They are also responsible for ensuring that any staff reassigned to the new duties have the required training and skills. ""During this critical time, our local delivery partners need the flexibility to be able to respond quickly and effectively to maintain essential frontline services,"" said Todd Smith, Minister of Children, Community and Social Services. ""We will continue to face these challenges together as we work to protect the health and safety of all Ontarians.""

Quick Facts

As announced on April 15, Ontario is restricting long-term care staff from working in more than one long-term care home, retirement home or health care setting to help stop the spread of COVID-19 between facilities.
Local Health Integration Networks are responsible for arranging in-home or school health and social services, and for processing placements in long-term care facilities for individuals who can no longer remain in their own homes.



Additional Resources


									Visit Ontario’s website to learn more about how the province continues to protect Ontarians from COVID-19  or to take a self assessment.
							

									The COVID-19 Action Plan: Long-Term Care Homes outlines the steps that the government is taking to protect residents and staff in long-term care homes.
							

									Ontario has launched an online portal to match available health care workers with employers.
							


"
35,2020-04-16,http://news.ontario.ca/mof/en/2020/04/ontario-enables-auto-insurance-companies-to-provide-driver-rebates-during-covid-19.html,Ontario Enables Auto Insurance Companies to Provide Driver Rebates During COVID-19 ,"
Ontario Enables Auto Insurance Companies to Provide Driver Rebates During COVID-19 
Regulatory Changes Open the Door for Auto Insurance Rebates

April 16, 2020  3:00 P.M.

Ministry of Finance


TORONTO — The Ontario government is enabling auto insurance companies to provide temporary insurance premium rebates to drivers during the COVID-19 pandemic. The province has amended a regulation under the Insurance Act to help ease the financial pressure on working people and families during this public health crisis.
By amending this regulation insurance companies would be able to provide auto insurance premium rebates to consumers for up to 12 months after the declared emergency has ended.  ""We are in an unprecedented time and people are experiencing extraordinary financial pressures,"" said Rod Phillips, Minister of Finance. ""My message to insurance companies has been clear: they should provide relief that reflects the financial hardships their dedicated customers are facing due to the COVID-19 outbreak."" ""All of us will remember how companies treat us during these unprecedented times. I often remind business leaders that their customers from the past five years are likely to be their customers for the next five years,"" said Phillips. ""Insurance companies indicated that the regulation preventing rebates was a barrier to providing relief to their customers. That barrier has now been removed so auto insurance companies can step up and do the right thing for the people and families of Ontario."" The Government and the Financial Services Regulatory Authority of Ontario (FSRA) will continue to work together to monitor how the auto insurance sector is responding. 

Quick Facts

Ontario is the first jurisdiction in Canada to remove existing restrictions on rebating so auto insurers can provide additional consumer relief. 
The rebating prohibition is designed to protect consumers from being misled in purchasing decisions based on a rebate and to provide consumer protection from insurers who may discriminate between consumers.
Auto insurance policy terms generally last for 12 months. The 12-month time period of this regulation would allow insurers to provide rebates to all policyholders, regardless of their annual policy renewal date.
The Financial Services Regulatory Authority of Ontario (FSRA) is an independent regulatory agency designed to improve consumer and pension plan beneficiary protections in Ontario. FSRA is responsible for monitoring compliance with and enforcing the Insurance Act and its regulations. 



Additional Resources


Financial Services Regulatory Authority of Ontario – Auto Insurance for Consumers



"
